keywords,summary,text,title,url
"['congress', 'surjewala', 'crore', 'modi', 'cong', 'debts', 'centre', 'asks', 'slams', '50', 'written', 'defaulters', 'worth', 'loans', 'rs', 'bad', 'waive']","“Waiving off bad loans of huge amounts for willful defaulters has become the mantra of the BJP.
On April 24, these bad loans were written off.
When the entire country is fighting the coronavirus pandemic and at least 14 crore people have lost their livelihood, how can the government possibly waive Rs 68,607 crore in bad loans?” Surjewala questioned.
In the list of 50 defaulters, absconding diamantaire Mehul Choksi and Nirav Modi are on top.
“Can the Modi government afford to waive such bad debts and if it manages to do so, the government needs to inform citizens how that is possible,” Surjewala said.","india

Updated: Apr 28, 2020 16:24 IST

The Congress on Tuesday lashed out at the Bharatiya Janata Party-led government at the Centre after a RTI query a couple of days ago revealed that the Reserve Bank of India (RBI) had written off a staggering amount of Rs 68,607 crore due from 50 defaulters, including absconding jeweller Nirav Modi and his partner Mehul Choksi.

Senior Congress leader Randeep Singh Surjewala who was interacting with the media via a video conference cited the RTI query and demanded to know how the government had the money to waive bad loans when the entire country was facing financial instability due to the Covid-19 pandemic.

“Waiving off bad loans of huge amounts for willful defaulters has become the mantra of the BJP. On March 16, 2020, Congress leader Rahul Gandhi had demanded to know the names of 50 loan defaulters from the Union government on the floor of the house. The government had refused to divulge those names. On April 24, these bad loans were written off. When the entire country is fighting the coronavirus pandemic and at least 14 crore people have lost their livelihood, how can the government possibly waive Rs 68,607 crore in bad loans?” Surjewala questioned.

“The Modi government has been unmasked and the fact that it is working towards writing off such bad debts shows that the government is hand in glove with the defaulters. In the list of 50 defaulters, absconding diamantaire Mehul Choksi and Nirav Modi are on top. We demand answers,” the Congress leader said.

“Can the Modi government afford to waive such bad debts and if it manages to do so, the government needs to inform citizens how that is possible,” Surjewala said.

Simultaneously, Surjewala reiterated the Congress party’s pledge to fight the Covid-19 health crisis along with the government and provide every possible support that the Centre may need.

Indian banks have technically written off a staggering amount of Rs 68,607 crore due from 50 top defaulters, according to a reply under RTI from the Reserve Bank of India (RBI).","Cong slams Centre, asks how it can afford to waive bad debts worth Rs 68,607 crore",https://www.hindustantimes.com/india-news/cong-slams-centre-asks-how-it-can-afford-to-waive-bad-debts-worth-rs-68-607-crore/story-9bcqiCZx7vgMbnQw6cPRbK.html
"['card', 'states', 'consider', 'proof', 'sc', 'centre', 'asks', 'migrant', 'scheme', 'subsidised', 'nation', 'ration', 'lockdown', 'local', 'petitioner']","indiaUpdated: Apr 28, 2020 16:34 ISTThe Supreme Court on Monday asked the central government to examine the feasibility of implementing the ‘one nation one ration card’ scheme during the Covid-19 lockdown so as to alleviate the hardships faced by migrant labourers who have been stranded in other states due to the lockdown.
The ‘one nation one ration card’ scheme formulated by the central government is proposed to kick in from June 2020.
They have run out of food and with no local identity proof like ration card or voter card to avail government benefits like subsidised food grains, they are facing hunger.
ration card/residential proof/ voter card,” the petitioner claimed.
“Indian Government as well as State Governments have to adopt the scheme of ‘One Nation One Umbrella’ without any discrimination and to save human lives”, the plea said.","india

Updated: Apr 28, 2020 16:34 IST

The Supreme Court on Monday asked the central government to examine the feasibility of implementing the ‘one nation one ration card’ scheme during the Covid-19 lockdown so as to alleviate the hardships faced by migrant labourers who have been stranded in other states due to the lockdown.

A three-judge bench, headed by Justice NV Ramana, passed the order on a plea by one Reepak Kansal, who had highlighted the plight of migrant labourers because they did not have local identity proof.

“…we direct the Union of India to consider whether it is feasible for it to implement the said scheme at this stage or not and take an appropriate decision in this regard keeping in view the present circumstances,” the court said disposing of the plea.

The ‘one nation one ration card’ scheme formulated by the central government is proposed to kick in from June 2020.

The petitioner pointed out that many migrant workers who left their home state to work in other cities have been confined to their rented accommodation and are unable to return to their home states due to the lockdown.

They have run out of food and with no local identity proof like ration card or voter card to avail government benefits like subsidised food grains, they are facing hunger.

“States and Union Territories have been giving preferences to its respective citizens and voters and denying benefits of subsidised grains, shelter, medical facilities to said migrants laborers/ employees of other states due to absence of local identity proof i.e. ration card/residential proof/ voter card,” the petitioner claimed.

The petitioner, therefore, prayed that the ‘one nation one ration card’ scheme which is proposed to come into effect from June 2020 should be implemented during the Covid-19 pandemic so that migrant labourers are not denied subsidised food grains and other government benefits.

“Indian Government as well as State Governments have to adopt the scheme of ‘One Nation One Umbrella’ without any discrimination and to save human lives”, the plea said.","SC asks Centre to consider ‘one nation, one ration card’ during lockdown",https://www.hindustantimes.com/india-news/sc-asks-centre-to-consider-one-nation-one-ration-card-during-lockdown/story-9fCuLyZBID38UqdZQpMq0M.html
"['jibe', 'killed', 'incident', 'sadhus', 'adityanath', 'communal', 'uttar', 'palghar', 'killing', 'thackeray', 'bulandshahr', 'thackerays', 'yogi', 'phone', 'stinging', 'way']","indiaUpdated: Apr 28, 2020 16:59 ISTMaharashtra chief minister Uddhav Thackeray spoke to his Uttar Pradesh counterpart Yogi Adityanath over the killing of two sadhus in UP’s Bulandshahr and expressed concern over it.
“I spoke to Uttar Pradesh chief minister Yogi Adityanath ji over the phone and expressed concern over the heinous murder of two sadhus in UP’s Bulandshahr.
However, I appeal to you that the incident should not be given a communal colour,” Thackeray said.
Adityanath had spoken to Thackeray after two sadhus were lynched in Maharashtra’s Palghar district earlier this month.
The bodies of the two sadhus were found inside a temple in a village in Bulandshahr on Monday night.","india

Updated: Apr 28, 2020 16:59 IST

Maharashtra chief minister Uddhav Thackeray spoke to his Uttar Pradesh counterpart Yogi Adityanath over the killing of two sadhus in UP’s Bulandshahr and expressed concern over it. Thackeray called for strict punishment for the perpetrators of the “heinous” crime and said that the incident should not be given a communal colour.

“I spoke to Uttar Pradesh chief minister Yogi Adityanath ji over the phone and expressed concern over the heinous murder of two sadhus in UP’s Bulandshahr. I told him that we are with you. Just the way we acted strongly in such a case, I wish you would do the same and bring the accused to justice. However, I appeal to you that the incident should not be given a communal colour,” Thackeray said.

Adityanath had spoken to Thackeray after two sadhus were lynched in Maharashtra’s Palghar district earlier this month. The Maharashtra home department had subsequently booked over 100 people in connection with the case.

While the BJP leaders suggested that the killing was intentional, the state government dismissed any communal angle in the Palghar lynching incident.

Sena leader Sanjay Raut had earlier tweeted on the killings, warning against giving it a communal twist. “Terrible! Killing of two saints, sadhus at a temple in Bulandshahar, UP, but I appeal to all concerned to not make it communal the way they tried to make Palghar, Maharashtra incident,” Raut said.

The bodies of the two sadhus were found inside a temple in a village in Bulandshahr on Monday night. The police arrested Murari alias Raju in connection with the murder of Jagdish or Rangidas, 55, and his 46-year-old disciple Sher Singh. The man told the police that it was “God’s will”.

“The accused claimed during interrogation that it was the will of God meaning there was no personal enmity,” a senior government official said while speaking to reporters.

Officials said Raju allegedly had an altercation with the sadhus over stealing their ‘chimta’ or tong.","In Thackeray’s phone call after 2 sadhus killed, a stinging jibe at Adityanath",https://www.hindustantimes.com/india-news/bulandshahr-killing-uddhav-thackeray-speaks-to-yogi-adityanath-calls-for-strict-punishment/story-nxngqislG20K0iQM7NrRaJ.html
"['directs', 'nagaland', 'days', 'labs', 'covid19', 'bench', 'high', 'state', 'court', 'patients', 'lab', 'dimapur', 'treatment', 'testing', 'set']","indiaUpdated: Apr 28, 2020 15:46 ISTThe Kohima bench of the Gauhati High Court on Tuesday directed the Nagaland government to set up two Covid-19 testing labs within 10 days.
Acting on a PIL filed by V Suokhrie, a division bench of Justice Songkhupchung Serto and Justice S. Hukato Swu ordered the Nagaland government to “make at least two testing labs of Covid-19 functional within 10 days”.
Nagaland doesn’t have a single testing lab for Covid-19 and all its samples are sent to labs in Assam.
He has also been counted among the Covid-19 patients of Assam by the Union health and family welfare ministry.
The health department also received 10 new ambulances on Tuesday which will cater exclusively to Covid-19 patients and those in quarantine,” Phom said.","india

Updated: Apr 28, 2020 15:46 IST

The Kohima bench of the Gauhati High Court on Tuesday directed the Nagaland government to set up two Covid-19 testing labs within 10 days.

Acting on a PIL filed by V Suokhrie, a division bench of Justice Songkhupchung Serto and Justice S. Hukato Swu ordered the Nagaland government to “make at least two testing labs of Covid-19 functional within 10 days”.

The court also directed the government to “make every effort to establish other labs at strategic places in the state to facilitate free testing in the future”.

Follow coronavirus latest updates here.

Nagaland doesn’t have a single testing lab for Covid-19 and all its samples are sent to labs in Assam. Till Monday, 629 samples from the state had been tested.

The lone Covid-19 case from the state, a 33-year businessman from Dimapur is undergoing treatment at the Guwahati Medical College Hospital (GMCH). He has also been counted among the Covid-19 patients of Assam by the Union health and family welfare ministry.

“The PIL was filed seeking the court’s indulgence on certain gaps which the respondents might have overlooked while dealing with Covid-19 preparedness in Nagaland,” said Neiteo Koza, counsel for the petitioner.

Though an IAF aircraft landed in Dimapur on April 16 with equipment needed to set up bio-safety level 3 (BSL-3) lab in Nagaland to test samples of suspected Covid-19 patients, the facility has not yet started functioning.

In its order, the HC asked the state government to provide sufficient PPE kits to all persons involved in treatment of Covid-19 patients and looking after persons in quarantine centres.

Till Monday 31 people were in quarantine in the state and 1,090 people had been screened, Nagaland health minister S Pangnyu Phom said.

The bench also directed that the state government should increase the number of ICU facilities and ventilators, provide ambulances to Covid-19 patients at the earliest and ensure that there is no shortage of trained personnel.

“The state received another batch of equipment to set up a BSL-3 testing lab at Dimapur and some additional equipment for the BSL-2 lab in Kohima on Monday. The health department also received 10 new ambulances on Tuesday which will cater exclusively to Covid-19 patients and those in quarantine,” Phom said.

The bench asked the government to ensure that the two hospitals - one in Dimapur and one in Kohima – are dedicated for treatment of Covid-19 patients are fully equipped and functional within two weeks.",High Court directs Nagaland to set up Covid-19 testing labs in 10 days,https://www.hindustantimes.com/india-news/high-court-directs-nagaland-to-set-up-covid-19-testing-labs-in-10-days/story-3P3Da5SJ6T5tvaPe6qIxlO.html
"['raped', 'minor', 'rape', 'sho', 'incidents', 'ajmer', 'accused', 'rajasthan', 'station', 'parents', 'sharma', 'sections', 'house', 'sirohi', 'separate', 'girls']","indiaUpdated: Apr 28, 2020 15:59 ISTRajasthan reported two separate incidents of suspected rape of minors from Ajmer and Sirohi districts o n Monday, according to the police.
“Her mother woke her father when she found that their daughter was missing on Monday early morning,” said Mahaveer Sharma, station house officer (SHO), Kekri police station, Ajmer district.
In Sirohi district, a 15-year-old minor girl was allegedly abducted and raped for three consecutive days by a person known to her.
Sumer Singh, station house officer (SHO), Pindwara police station, Sirohi district, said that on April 23 after the family finished their dinner, the teenager’s mother told her to lock the entrance gate of the house.
While she going to her friend’s house, the accused, who is known her, kidnapped her by gagging her mouth.","india

Updated: Apr 28, 2020 15:59 IST

Rajasthan reported two separate incidents of suspected rape of minors from Ajmer and Sirohi districts o n Monday, according to the police.

In Ajmer, an unidentified person abducted an 11-year-old girl at around 4 am on Monday from the courtyard of the house, where she was sleeping with her parents. “Her mother woke her father when she found that their daughter was missing on Monday early morning,” said Mahaveer Sharma, station house officer (SHO), Kekri police station, Ajmer district.

“An hour later, her parents found her in a field about a kilometre away from their home and her clothes were stained in blood. The parents lodged a first information report (FIR) on Monday and a case was registered against the unknown accused under the Protection of Children from Sexual Offences (POCSO) Act, 2012, and Sections 376 (rape), and 363 (kidnapping) of the Indian Penal Code (IPC),” SHO Sharma said.

In Sirohi district, a 15-year-old minor girl was allegedly abducted and raped for three consecutive days by a person known to her. On Monday, the accused dropped the rape survivor at her home after which she shared the ordeal with her parents.

Sumer Singh, station house officer (SHO), Pindwara police station, Sirohi district, said that on April 23 after the family finished their dinner, the teenager’s mother told her to lock the entrance gate of the house.

“When she went near the entrance gate, one of her friends in the neighbourhood called her. While she going to her friend’s house, the accused, who is known her, kidnapped her by gagging her mouth. She was taken to a nearby government-run school, which is closed because of the ongoing nationwide lockdown restrictions to prevent the spread of the coronavirus disease (Covid-19) outbreak, and raped her for three consecutive days,” said SHO Singh.

“On Monday, her family members filed an FIR. A case was registered under the POCSO Act and Section 376 (rape) and other relevant sections of the IPC. The rape survivor’s statement has been recorded. Her medical reports are awaited, but further investigations are on,” he added.",2 minor girls raped in Rajasthan in separate incidents: Police,https://www.hindustantimes.com/india-news/2-minor-girls-raped-in-rajasthan-in-separate-incidents-police/story-Bfvd7IAN9oNDUU1zdxZlUO.html
"['scientist', 'writes', 'forest', 'govt', 'warns', 'etalin', 'projects', 'hydropower', 'lakes', 'rivers', 'hydro', 'climate', 'project', 'lake', 'glacial', 'glaciers', 'valley', 'impact', 'dibang']","Another scientist writes to govt, warns about climate change impact in Dibang Valley over hydro projectsindiaUpdated: Apr 28, 2020 15:16 ISTAnother scientist studying rivers in Arunachal Pradesh’s Dibang Valley has warned the government about climate change-induced natural hazards that hydropower dams may not be able to withstand.
Dibang Valley has close to 300 glaciers in an area of 200 sqkm and there are about 350 glacial lakes covering an area of 50 sqkm.
Though Sheth has flagged concerns for all projects in the region, FAC is currently considering granting forest clearance to the Etalin hydropower project.
Dam breach model studies for hydropower projects account for only extreme rainfall floods.
“A decision on the Etalin Hydropower project will be announced when the minutes of the FAC meeting is released,” a committee member said.","Another scientist writes to govt, warns about climate change impact in Dibang Valley over hydro projects

india

Updated: Apr 28, 2020 15:16 IST

Another scientist studying rivers in Arunachal Pradesh’s Dibang Valley has warned the government about climate change-induced natural hazards that hydropower dams may not be able to withstand.

Chintan Sheth’s letter to the Forest Advisory Committee (FAC) of the Union ministry of environment has come after several scientists issued a similar warning to the government over granting forest clearance for the 3,097 megawatt (MW) Etalin hydroelectric project in an area rich in subtropical evergreen and rain forests and rare flora and fauna.

Dibang Valley has close to 300 glaciers in an area of 200 sqkm and there are about 350 glacial lakes covering an area of 50 sqkm. Glacial lakes indicate these areas had much larger glaciers that have now completely melted due to warming, Sheth has said in his three-page letter.

Suggesting a cautious approach to siting hydropower projects in the region, the former research fellow with National Centre for Biological Sciences said Arunachal Pradesh has a vast elevation gradient and is drained by Tibetan rivers such as the Subansiri, Lohit and Siang.

It is well known that these rivers are primarily fed by melting glaciers, snow cover and monsoon rainfall so are the rivers in Dibang Valley, he said.

“I have currently mapped and detected rapid melting of glaciers since 2009 on the Mathũ (Mathun), Dri and Talõ (Tangon) rivers as well as recent emergence and expansion of glacial lakes,” he wrote.

“The Etalin hydroelectric power project proposes two dams on these rivers. The risk of such projects upstream closer to glaciers and glacial lakes is extremely high due to the unpredictable nature of the volume and flow rate during glacial lake outburst floods,” he said.

Though Sheth has flagged concerns for all projects in the region, FAC is currently considering granting forest clearance to the Etalin hydropower project.

The risk of hydropower projects upstream closer to glaciers and glacial lakes is extremely high due to the unpredictable nature of the volume and flow rate during glacial lake outburst floods.

Dam breach model studies for hydropower projects account for only extreme rainfall floods.

“Even if the dam structures do withstand a glacial lake outburst flood, the dam itself acts as a barrier effectively creating a lake that drains after overtopping. In effect, a dam creates a second lake that floods further downstream, after it over-topples, rapidly increasing the energy and flow rate of water,” Sheth said.

“In contrast the natural topography of a river allows the water to spread and dissipate energy across the length and width of the river channel decreasing the flow rates as the flood propagates downstream,” he added.

Anil Kulkarni, a glaciologist at Indian Institute of Science, said: “The glaciers there are relatively small and they have not been studied enough.”

“We have to understand that the climate is changing and will change significantly in the coming years. First, we need to understand how climate will change in the region and how the pattern of stream runoff will be influenced,” Kulkarni said over the phone from Bengaluru.

“Another study needed is will there be a change in the volume of water in future? Also in case of a run of the river projects, the distance between the dam and the outlet is usually dry which causes irreversible changes to aquatic life and water availability for local people. We need to critically study these impacts,” he said.

HT had reported on April 23 that a sub-committee of FAC, which visited the Etalin hydropower project site in February, has recommended in their report on April 21 that the project of 3097MW can be allowed with a condition that the developer deposit money for wildlife conservation in the area.

The project will involve diversion of 1150.08 ha of forest land and felling of 2.7 lakh trees in what is described as “subtropical evergreen broad-leaved forest and subtropical rain forests” in FAC’s documents.

“A decision on the Etalin Hydropower project will be announced when the minutes of the FAC meeting is released,” a committee member said.","Another scientist writes to govt, warns about climate change impact in Dibang Valley over hydro projects",https://www.hindustantimes.com/india-news/another-scientist-writes-to-govt-warns-about-climate-change-impact-in-dibang-valley-over-hydro-projects/story-fZa3k6Dzba585Mq5C8UzkL.html
"['rishikesh', 'woman', 'covid19', 'tested', 'officer', 'tests', 'nainital', 'uttarakhand', 'increases', 'twice', 'hospital', 'positive', 'admitted', 'tally', 'aiims']","indiaUpdated: Apr 28, 2020 14:58 ISTA 56-year-old woman from Nainital district tested positive for Covid-19 at All India Institute of Medical Sciences (AIIMS) Rishikesh on Tuesday, informed officials.
With this, the tally of Coronavirus positive patients in Uttarakhand has increased to 52 with 33 patients recovering successfully.
We took her samples yesterday evening for a precautionary test before conducting any medical procedure on her and she tested positive today.
On Sunday, a nursing officer from AIIMS Rishikesh had tested positive for coronavirus.
UB Mishra, dean of AIIMS Rishikesh said that a nursing officer working with the urology department tested positive on Sunday after first showing symptoms on April 24.","india

Updated: Apr 28, 2020 14:58 IST

A 56-year-old woman from Nainital district tested positive for Covid-19 at All India Institute of Medical Sciences (AIIMS) Rishikesh on Tuesday, informed officials. With this, the tally of Coronavirus positive patients in Uttarakhand has increased to 52 with 33 patients recovering successfully.

Harish Mohan Thapliyal, public relations officer of AIIMS Rishikesh said that the 56-year-old woman had been admitted to the hospital due to an ailment in her brain and she tested positive before the procedure on Tuesday.

“The lady, a resident of Nainital was first admitted to a hospital there and then referred to a hospital in Bareilly before being admitted to AIIMS Rishikesh on April 22. We took her samples yesterday evening for a precautionary test before conducting any medical procedure on her and she tested positive today. The next course of action is being decided by the doctors,” said Thapliyal.

He added that the woman had tested negative twice earlier when she was tested in Nainital and Bareilly.

“As the woman had tested negative twice, we are trying to find out her source of contracting the virus. Here, she was first kept in an emergency ward and we are tracing out her contacts, but as a primary measure we will be keeping around 70 staff members of ours under quarantine and testing them,” added the official.

On Sunday, a nursing officer from AIIMS Rishikesh had tested positive for coronavirus.

UB Mishra, dean of AIIMS Rishikesh said that a nursing officer working with the urology department tested positive on Sunday after first showing symptoms on April 24.



The HT Guide to Coronavirus COVID-19","Uttarakhand woman admitted in AIIMS Rishikesh tests positive for Covid-19, tally increases to 52",https://www.hindustantimes.com/india-news/uttarakhand-woman-admitted-in-aiims-rishikesh-tests-positive-for-covid-19-tally-increases-to-52/story-rNQ4t9Gi88o7opQLC4RlxJ.html
