keywords,summary,text,title,url
"['approved', 'covid19', 'coronavirus', 'dangerous', 'centre', 'patients', 'therapy', 'research', 'treatment', 'reported', 'plasma', 'study', 'trial', 'used', 'health']","The government added further that plasma therapy could lead to life-threatening complications if not administered properly.
“There is no approved therapy for Covid-19 in the country including Plasma therapy.
Plasma therapy is being experimented with and there is no evidence to support it as a treatment.
The Plasma therapy has been used selectively so far, mostly in severe cases where patients were on ventilator support.
The HT Guide to Coronavirus COVID-19Use of plasma therapy involves injecting blood-component plasma extracted from a cured coronavirus patient into a positive case.","india

Updated: Apr 28, 2020 17:24 IST

The Union health ministry on Tuesday advised against considering the plasma therapy to be a regular treatment for coronavirus and added that it should only be used for research and trial purposes till the time there’s robust scientific evidence to support its efficacy.

The government added further that plasma therapy could lead to life-threatening complications if not administered properly.

“There is no approved therapy for Covid-19 in the country including Plasma therapy. Plasma therapy is being experimented with and there is no evidence to support it as a treatment. It is only at an experimental stage. If not used properly, it can create life-threatening complications,” said Lav Agarwal, joint secretary health ministry.

The health ministry official said that the country’s top medical research body was conducting a study to find out the efficacy of plasma therapy and till then, doctors are advised to use it only for trial purposes.

“Plasma therapy is only to be used for research and trial purposes until an ICMR study on its efficacy is completed. ICMR is conducting a nation-wide research to study the efficacy of Plasma therapy,” he added.

Government’s word of caution on plasma therapy comes at a time when several instances of it helping in virus-infected patients’ recovery have been reported. The Plasma therapy has been used selectively so far, mostly in severe cases where patients were on ventilator support.

The HT Guide to Coronavirus COVID-19

Use of plasma therapy involves injecting blood-component plasma extracted from a cured coronavirus patient into a positive case. The plasma of a cured patient is considered to carry virus-fighting antibodies which boost the immune system’s response to the disease. Plasma is the almost-clear liquid left behind after red and white blood cells and platelets are removed from the blood.

Convalescent plasma therapy uses a blood component called plasma, which contains the virus-fighting antibodies, from people who have recovered from the infection to treat those who are severely ill with Covid-19

Several Covid-19 fighting medical care centres in India are reported to have started banking plasma from coronavirus recovered patients after its use was said to have shown positive results.

A few days ago, Delhi health minister Satyendra Jain had reported that six critical coronavirus patients had “nearly recovered” after administration of the plasma therapy. On April 26, it was reported that Mumbai’s Lilavati hospital, too, had identified Maharashtra’s first patient to be given the therapy.



For Coronavirus Live Updates

One of Delhi’s designated coronavirus hospital, Lok Nayak hospital is already using the plasma therapy and the All India Institute of Medical Sciences (AIIMS) is reported is to getting ready to start it for those with severe Covid-19 infections.","Plasma therapy not approved treatment for Covid-19, can be dangerous, says Centre",https://www.hindustantimes.com/india-news/plasma-therapy-not-approved-treatment-for-covid-19-can-be-dangerous-says-centre/story-vTeSdM43Q7ND3lUiThCAZK.html
"['activities', 'update', 'coronavirus', 'health', '937', 'world', 'rises', 'deaths', 'vijcovid19', 'latest', 'lav', 'covid19', 'cases', 'india', 'recorded', '29974', 'indias', 'weekvillages', 'tally']","Rajasthan health minister says 10k tests per day within next weekVillages to have teams to ensure delivery of items during lockdownWayanad, Kalimpong have not reported any cases: Lav AgarwalICMR says plasma therapy is still in experimental stage: Lav AgarwalThere is no Bhilwara or Agra model: Lav AgarwalOlympics not possible without vaccines: Japanese medical associationHaryana will be fine if borders are sealed for 15-20 days: VijCovid-19 allows Pakistan to buy time from FATF blacklistingUS President says opponents are 'viciously griping'Coronavirus update: A resident undergoes thermal screening at an apartment in Gurugram on Monday.
Coronavirus cases in India are nearing the 30,000-mark as the count of total cases climbed to 29,974, while the death toll stood at 937, according to latest figures released by the Union ministry of health on Tuesday evening.
Covid-19 has halted economic activities globally as more than 3 million remain infected and rest of the world remains indoors.
States in India have allowed resumption of some activities to stop the country's economy from suffering from more losses due to the pandemic.
Click here for complete coronavirus coverageFollow latest updates on coronavirus here","Rajasthan health minister says 10k tests per day within next week

Villages to have teams to ensure delivery of items during lockdown

Wayanad, Kalimpong have not reported any cases: Lav Agarwal

ICMR says plasma therapy is still in experimental stage: Lav Agarwal

There is no Bhilwara or Agra model: Lav Agarwal

Olympics not possible without vaccines: Japanese medical association

Haryana will be fine if borders are sealed for 15-20 days: Vij

Covid-19 allows Pakistan to buy time from FATF blacklisting

US President says opponents are 'viciously griping'

Coronavirus update: A resident undergoes thermal screening at an apartment in Gurugram on Monday.

Coronavirus cases in India are nearing the 30,000-mark as the count of total cases climbed to 29,974, while the death toll stood at 937, according to latest figures released by the Union ministry of health on Tuesday evening.

Covid-19 has halted economic activities globally as more than 3 million remain infected and rest of the world remains indoors. States in India have allowed resumption of some activities to stop the country's economy from suffering from more losses due to the pandemic.

Click here for complete coronavirus coverage





Follow latest updates on coronavirus here","Covid-19 update: India's tally rises to 29,974 cases, 937 deaths recorded",https://liveupdates.hindustantimes.com/india/covid-19-updates-us-records-1-303-coronavirus-deaths-in-24-hours-says-report-21588034382150.html
"['tablighi', 'remark', 'bjp', 'spreading', 'mla', 'jamaatis', 'coronavirus', 'tiwari', 'sellers', 'vegetables', 'muslim', 'defends', 'deoria', 'stop', 'vendors', 'buying', 'suggested']","“On April 18, I was distributing masks among people in Deoria when I came across general complaints from people who expressed fear that Tablighi Jamaatis are spreading the infection in Deoria.
As a responsible MLA, I asked them not to take law in their hand, but simply stop buying vegetables from them.
UP Congress president Ajay Kumar Lallu blamed the legislator’s party for spreading hatred even at the time of a pandemic .
The Tablighi Jamaatis who were under attack and blamed for spreading the coronavirus have set an example by donating their plasma to cure patients.
I am confident that the countrymen will put up a united fight against Covid-19 by neglecting such comments,” said the Congress leader.","india

Updated: Apr 28, 2020 15:38 IST

A Bharatiya Janata Party MLA from Uttar Pradesh’s Deoria district kicked off a political row when he suggested to people of his constituency not to buy vegetables from Muslim vendors to avoid contracting the coronavirus infection.

In a video, now gone viral, Suresh Tiwari is seen appealing to people: “You all should keep one thing in mind, I am telling you openly: do not buy vegetables from Mia ( Muslims).”

When contacted, Tiwari confirmed to have made the remark and clarified that he suggested it as a precautionary measure to check the spread of infection after people complained to him about the role of Tablighi Jamaatis in spreading the deadly virus.

There have been several instances of the people from the minority community complaining of discrimination and harassment after a global religious congregation in New Delhi in mid-March, held by Tablighi Jamaat, an Islamic movement of preachers, turned into a hotspot of Covid-19 cases.

“On April 18, I was distributing masks among people in Deoria when I came across general complaints from people who expressed fear that Tablighi Jamaatis are spreading the infection in Deoria. Many of them were worried that Muslim vendors are infecting vegetable with saliva. As a responsible MLA, I asked them not to take law in their hand, but simply stop buying vegetables from them. Tell me, what wrong have I done by saying such things,” said the Barhaj MLA.

Tiwari’s remark drew sharp reaction from the opposition parties.

UP Congress president Ajay Kumar Lallu blamed the legislator’s party for spreading hatred even at the time of a pandemic .

“At a time when the country and state are facing the coronavirus crisis, BJP leaders are busy fanning hatred .It’s a shameful act which has exposed the real face of the BJP. The Tablighi Jamaatis who were under attack and blamed for spreading the coronavirus have set an example by donating their plasma to cure patients. I am confident that the countrymen will put up a united fight against Covid-19 by neglecting such comments,” said the Congress leader.","BJP MLA says stop buying vegetables from Muslim sellers, defends remark",https://www.hindustantimes.com/india-news/bjp-mla-says-stop-buying-vegetables-from-muslim-sellers-defends-remark/story-X0SQ9kLEmmk4LCpbyUTYGM.html
"['significant', 'drug', 'covid19', 'cases', 'arthritis', 'storms', 'shows', 'treatment', 'immune', 'results', 'tocilizumab', 'study', 'severe', 'standard', 'bodys', 'promise']","worldUpdated: Apr 28, 2020 18:07 ISTThe arthritis drug tocilizumab has shown early promise in preventing extreme inflammation in gravely ill COVID-19 patients, according to a French clinical study.
Half received two injections of tocilizumab as well as standard treatment with antibiotics, while the control group received only standard treatment.
While the results are yet to be published, those involved in the research said it showed clear “clinical benefit” of tocilizumab treatment.
It is a lab-synthesised antibody that inhibits against a specific protein receptor involved in the body’s natural immune response.
Several existing drugs, including anti-viral medicines, are currently being trialled worldwide for Covid-19 treatment.","world

Updated: Apr 28, 2020 18:07 IST

The arthritis drug tocilizumab has shown early promise in preventing extreme inflammation in gravely ill COVID-19 patients, according to a French clinical study.

The treatment, which suppresses the body’s natural immune response, was found to reduce “significantly” the number of deaths or life support interventions compared with a control group of patients.

The study, carried out by the Paris university hospital trust (AP-HP), looked at 129 people hospitalised with moderate or severe viral pneumonia, which occurs in 5-10 percent of Covid-19 patients.

Half received two injections of tocilizumab as well as standard treatment with antibiotics, while the control group received only standard treatment.

While the results are yet to be published, those involved in the research said it showed clear “clinical benefit” of tocilizumab treatment.

AP-HP said it had decided to publicise the study before publishing official results “for public health reasons”.

They stressed however that further research was needed on the effectiveness of the drug and the potential for side effects.

Tocilizumab, sold under the brand names Actemra and RoAcemtra, is commonly used to treat rheumatoid arthritis.

It is a lab-synthesised antibody that inhibits against a specific protein receptor involved in the body’s natural immune response.

Researchers believe the drug might be able to stave off a state of heightened immune response known as cytokine storms -- where the body’s reaction to a foreign body such as a disease or chemical creates acute inflammation.

Cytokine storms can be deadly and occur in severely ill Covid-19 patients.

Tocilizumab currently costs around 800 euros ($870) per injection.

Several existing drugs, including anti-viral medicines, are currently being trialled worldwide for Covid-19 treatment.",Arthritis drug shows ‘significant’ promise in severe Covid-19 cases: Study,https://www.hindustantimes.com/world-news/arthritis-drug-shows-significant-promise-in-severe-covid-19-cases-study/story-JKjGFXhqL2aIWKU0SSlK5K.html
"['postdelivery', 'trolls', 'smriti', 'week', 'birth', 'think', 'post', 'called', 'shared', 'really', 'wrote', 'responds', 'haters', 'pic', 'khanna', 'images', 'edited', 'body']","tvUpdated: Apr 28, 2020 17:50 ISTTV actor Smriti Khanna, who has impressed the internet with her body transformation days after giving birth, has responded to haters who claimed her postpartum images were photoshopped.
She was heavily trolled after she shared her photos a week before and after giving birth to her daughter.
Smriti had shared a collage of her pre and post delivery images where a flat stomach and slim body could be clearly seen.
The images used in the collage were from a week before and after the delivery.
She wrote alongside her post, “Amazed at what the human body can do!!","tv

Updated: Apr 28, 2020 17:50 IST

TV actor Smriti Khanna, who has impressed the internet with her body transformation days after giving birth, has responded to haters who claimed her postpartum images were photoshopped. She was heavily trolled after she shared her photos a week before and after giving birth to her daughter.

Responding to the trolls, Smriti posted a mirror selfie on her Instagram Story and wrote, “For people who think these pics are old, you really think I will put a cot in my room even before getting pregnant?” She also shared a video showcasing her perfectly fit body and wrote, “To all the haters who think my pictures are edited.” Smriti has also posted a mirror selfie, thanking her fans.

Smriti had shared a collage of her pre and post delivery images where a flat stomach and slim body could be clearly seen. The images used in the collage were from a week before and after the delivery. She wrote alongside her post, “Amazed at what the human body can do!! 1st pic was taken one week before I gave birth. Second pic, a week after I gave birth. My inbox is flooded with questions from new moms and moms-to-be. I’ll try and make a video soon answering all of them. Thank you for so much love and blessings for our little one #postpartum #postpartumtransformation #newmom #mombod.”

While several users trolled her, she also had an army of fans defending her. “M a new mom and i can really recognize its a true pic... n nothing fake in it. And yes it completely depends on the genes n how you maintain yourself during pregnancy. Congratulations.. be happy. N dont give much attention to critics,” wrote one.

Speaking about her pregnancy, Smriti had recently said in an interview, “I was panicking before the lockdown happened. Gautam, my father and brother-in-law, everyone was going out to work and I was the only one staying at home. So, I was panicking a lot at that time because they used to come back home meeting lots of people. I was reading and there was not much information about pregnant women during the Coronavirus crisis. That was causing anxiety which is not good at this time. I was trying to keep myself calm. When the lockdown happened, I was a little relieved in fact. So that way, we are in a safer environment now but still, I am thinking of what will happen after the lockdown. The best thing is you have to have faith in God. The babies are going to be super strong now to be born in this environment and also the moms. I really feel for them. I also have a few friends who are due and we keep encouraging each other.”

Earlier this month, Smriti had shared the news of arrival of her daughter with a picture and wrote, “Our princess has arrived 15.04.2020.” Several of her showbiz industry colleagues and friends showered the post with love. Dia Mirza expressed her happiness as she wrote: “Oh YAYYYYYYYY SO SO SO HAPPY!!! This is the best news. Can’t wait to meet our little angel” while actor Ruslaan Mumtaz commented, “Hey, such great news. congratulations so happy for you guys @smriti_khanna.”

Mouni Roy wrote: “Heartiest congratulations all my love and blessings to the lil one.” Angrezi Medium actor Radhika Madan said: “Whaaaaat!!!congratulations you guys!!!!!”

Follow @htshowbiz for more",‘To all the haters’: Smriti Khanna responds to trolls who called her post-delivery images edited,https://www.hindustantimes.com/tv/to-all-the-haters-smriti-khanna-responds-to-trolls-who-called-her-post-delivery-images-edited/story-rLUHDmJ5webiOeoU24yJbO.html
"['pakistan', 'terror', 'months', 'watchdog', 'covid19', 'plan', 'gets', 'implement', 'funding', 'fatfs']",Pakistan gets 4 more months due to Covid-19 to implement terror funding watchdog FATF’s action plan,Pakistan gets 4 more months due to Covid-19 to implement terror funding watchdog FATF’s action plan,Pakistan gets 4 more months due to Covid-19 to implement terror funding watchdog FATF’s action plan,https://www.hindustantimes.com/world-news/amid-covid-19-crisis-pakistan-gets-4-more-months-to-implement-terror-funding-watchdog-fatf-s-action-plan/story-bC4OsMf7oduz821RSmG1rO.html
"['irrfan', 'funeral', 'films', 'mother', 'film', 'medium', 'kokilaben', 'treatment', 'undergoing', 'actor', 'khan', 'hospital', 'video']","bollywoodUpdated: Apr 28, 2020 17:49 ISTActor Irrfan Khan is in Mumbai and has been undergoing treatment at the Kokilaben Dhirubhai Ambani Hospital, his representatives have said, responding to reports that the actor has been admitted to the ICU.
Irrfan in 2018 announced that he had been diagnosed with a neuroendocrine tumour, and sought treatment abroad.
The actor lost his mother, Saeeda Begum, on Saturday, and was reported to have attended her funeral via video call.
Also read: Irrfan Khan attends mother Saeda Begum’s funeral via video conferencingAhead of the film’s debut, Irrfan had shared a video message about his condition.
I hope this film is able to make you laugh and cry in equal measure.”Follow @htshowbiz for more","bollywood

Updated: Apr 28, 2020 17:49 IST

Actor Irrfan Khan is in Mumbai and has been undergoing treatment at the Kokilaben Dhirubhai Ambani Hospital, his representatives have said, responding to reports that the actor has been admitted to the ICU. More details are awaited.

Irrfan in 2018 announced that he had been diagnosed with a neuroendocrine tumour, and sought treatment abroad. The actor lost his mother, Saeeda Begum, on Saturday, and was reported to have attended her funeral via video call. Irrfan’s mother was 95.

The actor most recently appeared in Angrezi Medium, which was one of the last films to have been released before the nationwide coronavirus lockdown. The film took a hit at the box office and was given an early release on streaming.

Also read: Irrfan Khan attends mother Saeda Begum’s funeral via video conferencing

Ahead of the film’s debut, Irrfan had shared a video message about his condition. “Hello, brothers and sisters,” Irrfan said in a voiceover, in Hindi. “I am with you and not with you. This film, Angrezi Medium, is very special to me. I truly wanted to promote this film as passionately as we made it, but there are some ‘unwanted guests’ in my body and they’re keeping me busy. I’ll keep you informed on that front.”

He continued, “One doesn’t have any other choice but to remain positive. Whether you are able to make lemonade in such situations is entirely up to you. We’ve made this film with the same sort of positivity. I hope this film is able to make you laugh and cry in equal measure.”

Follow @htshowbiz for more",Irrfan Khan undergoing treatment at Kokilaben hospital,https://www.hindustantimes.com/bollywood/irrfan-khan-undergoing-treatment-at-kokilaben-hospital/story-Z90Hlkjnb5oreUcUjDNyMI.html
"['allow', 'border', 'vigil', 'travel', 'strict', 'vehicles', 'wants', 'valid', 'passes', 'delhifaridabad', 'working', 'told', 'interstate', 'cross', 'pass']","gurugramUpdated: Apr 28, 2020 17:40 ISTPolice kept a strict vigil at Delhi-Faridabad border on Tuesday as no one without a valid inter state pass was allowed to cross the border from either side.
Even as many people cited one or the other reasons to cross the border, the cops stood firm on their ground and did not allow them to cross border.
We will not allow anyone to cross the border.
We have received orders from the government to follow this protocol and we are only doing our job,” he added.
Similarly, at the Delhi-Gurugram border, a long queue of vehicles was seen as police personnel check passes of people commuting through the route amid the lockdown.","gurugram

Updated: Apr 28, 2020 17:40 IST

Police kept a strict vigil at Delhi-Faridabad border on Tuesday as no one without a valid inter state pass was allowed to cross the border from either side.

Even as many people cited one or the other reasons to cross the border, the cops stood firm on their ground and did not allow them to cross border.

“The border has been sealed. I am thankful to our government for implementing the decision to close all the borders as it would help in managing the number of coronavirus cases,” SI Hukaam Singh told ANI.

“We have also told people that they should stay where they are working. We will not allow anyone to cross the border. If someone wants to go, then he must have an interstate pass. We have received orders from the government to follow this protocol and we are only doing our job,” he added.

Similarly, at the Delhi-Gurugram border, a long queue of vehicles was seen as police personnel check passes of people commuting through the route amid the lockdown.","Strict vigil at Delhi-Faridabad border, inter-state passes must for travel",https://www.hindustantimes.com/gurugram/strict-vigil-at-delhi-faridabad-border-inter-state-passes-must-for-travel/story-vxfFUL1EQFfZbmiiftFLFK.html
"['negative', 'test', 'taken', 'punjab', 'covid19', 'tested', 'tests', 'constable', 'infection', 'constables', 'second', 'report', 'village', 'testing', 'samples']","citiesUpdated: Apr 28, 2020 17:23 ISTTen days after a 27-year-old Punjab Police constable contracted the novel coronavirus disease (Covid-19), his first test report since the infection has turned out negative.
However, in compliance with the medical protocol, his samples were taken again for testing on Tuesday.
The cop will be declared cured if the result of the second test is negative, officials said.
Meanwhile, the reports of all of his 34 primary contacts, including his 58-year-old father, 52-year-old mother, 25-year-old wife and one-year-old son, came out negative a week ago.
The constable was the driver of Ludhiana assistant commissioner of police (ACP) Anil Kohli, who had tested positive for Covid-19 on April 13 and passed away a few days later.","cities

Updated: Apr 28, 2020 17:23 IST

Ten days after a 27-year-old Punjab Police constable contracted the novel coronavirus disease (Covid-19), his first test report since the infection has turned out negative.

However, in compliance with the medical protocol, his samples were taken again for testing on Tuesday. The cop will be declared cured if the result of the second test is negative, officials said.

Ferozepur sub-divisional magistrate Amit Gupta said, “The report of the second test is likely to be received by late night today.”

The constable, a resident of Wara Bhai Ka village here, had tested positive for Covid-19 on April 17, following which he was shifted to the isolation ward of the civil hospital.

Meanwhile, the reports of all of his 34 primary contacts, including his 58-year-old father, 52-year-old mother, 25-year-old wife and one-year-old son, came out negative a week ago.

The constable was the driver of Ludhiana assistant commissioner of police (ACP) Anil Kohli, who had tested positive for Covid-19 on April 13 and passed away a few days later.

The constable had returned to his native village on April 14. This is the first and only case to be reported in the border district till today.

After samples of the ACP’s three gunmen and driver were taken for testing, they were sent to their respective residences in Khanna, Moga, Ferozepur and Sangrur as their neighbours in Ludhiana objected to their presence.",Punjab Police constable’s first Covid-19 report since infection tests negative,https://www.hindustantimes.com/cities/punjab-police-constable-s-first-covid-19-report-since-infection-tests-negative/story-H7AqGx3DAgegYRkBNNnItL.html
