keywords,summary,text,title,url
"['number', 'emerge', 'nagpur', 'maharashtra', 'quarantine', 'covid19', 'cases', '80', 'total', 'toll', 'state', 'reported', 'hardesthit', 'quarantined', '750']","indiaUpdated: Apr 28, 2020 14:58 ISTThere was a sudden spurt in the number of Covid-19 cases in Maharashtra’s Nagpur on Tuesday, after which the authorities quarantined 750 people.
“We have quarantined 750 people from Satranjipura in Nagpur and will quarantine 500 more persons from there.
Maharashtra has the highest number of Covid-19 cases in the country.
The state reported 522 new cases on Monday, taking the total number of the infected people to 8,590, a health department official said.
The number of Covid-19 positive cases in the Pune division stood at 1,193 with 87 deaths, followed by Nashik division with 244 cases and 23 deaths, the official said.","india

Updated: Apr 28, 2020 14:58 IST

There was a sudden spurt in the number of Covid-19 cases in Maharashtra’s Nagpur on Tuesday, after which the authorities quarantined 750 people.

“We have quarantined 750 people from Satranjipura in Nagpur and will quarantine 500 more persons from there. We took this step as 80 cases were reported from the area and we found missing links in contact tracing,” news agency ANI quoted Nagpur Municipal Corporation Commissioner Tukaram Mundhe as saying.

Maharashtra has the highest number of Covid-19 cases in the country. The state reported 522 new cases on Monday, taking the total number of the infected people to 8,590, a health department official said.

With 27 more fatalities, the overall Covid-19 death toll mounted to 369, he said.

Of the 522 new cases in Maharashtra, Mumbai alone accounted for 39 cases and 15 fatalities, the BrihanMumbai Municipal Corporation (BMC) said in a release.

The total number of coronavirus positive people in the country’s financial capital now stands at 5,589 and the overall death toll at 219, the release further said.

The number of Covid-19 positive cases in the Pune division stood at 1,193 with 87 deaths, followed by Nashik division with 244 cases and 23 deaths, the official said.

Maharashtra has so far tested 1,21,562 samples of which 1,12,552 came negative for the novel coronavirus whereas 8,590 are positive.

The number of the people discharged after recovering from the Covid-19 disease is 1,282.

A total of 1,45,677 people are currently in home quarantine across the state while 9,399 others in institutional quarantine.",80 new Covid-19 cases emerge in Nagpur in hardest-hit Maharashtra; 750 people quarantined,https://www.hindustantimes.com/india-news/80-new-covid-19-cases-emerge-in-nagpur-in-hardest-hit-maharashtra-750-people-quarantined/story-jE3IZOs2gN1MPxtFyknWUM.html
"['states', 'quarantine', 'countries', 'abroad', 'india', 'modi', 'plan', 'right', 'evacuate', 'indian', 'modis', 'united', 'indians', 'workers', 'bluecollar']","In PM Modi’s plan to evacuate Indians, blue-collar workers have the first rightindiaUpdated: Apr 28, 2020 17:31 ISTAs the foreign and civil aviation ministries start work on a plan to fly back tens of thousands of Indians stuck abroad, Prime Minister Narendra Modi has spelt out the ground rule for the evacuation plan.
India’s blue collar workers stranded abroad will get the first seats in the special flights that will be run by the government to get them home.
But the Covid-19 pandemic has hit the Indian workers in West Asian countries hard.
Also Read: 70% of Indian citizens abroad are in 6 W Asian nations, shows dataIndian workers in six Gulf countries account for 70 percent of 12.6 million Indians abroad.
Kerala has been first off the block, announcing that they were prepared to accommodate at least two lakh expatriates, mainly blue-collar workers, at its special quarantine centres.","In PM Modi’s plan to evacuate Indians, blue-collar workers have the first right

india

Updated: Apr 28, 2020 17:31 IST

As the foreign and civil aviation ministries start work on a plan to fly back tens of thousands of Indians stuck abroad, Prime Minister Narendra Modi has spelt out the ground rule for the evacuation plan. India’s blue collar workers stranded abroad will get the first seats in the special flights that will be run by the government to get them home.

Students stranded in different countries will be next. Then, everyone else including Indians who were travelling for work, or pleasure.

“The prime minister was very clear… That the Indian expatriate workforce should get the first choice to return,” a top government official told Hindustan Times.

At one meeting, PM Modi pointed out how the poorest of Indian immigrant workers - mostly in the Gulf countries - had helped India tide over the economic crisis. Like in 1998, PM Modi told them, when the United States and other western countries imposed economic sanctions on India after the then PM Atal Bihari Vajpayee detonated five underground nuclear bombs in Pokhran in May 1998.

Also Watch | ‘Surviving on cold food’: Stranded Indian students in US seek govt’s help for evacuation

The Resurgent India Bond floated by the State Bank of India was targeted to raise $2 billion; it netted more than $4 billion.

Two decades later, India’s massive diaspora is still sending money home. In 2019, according to the World Bank, India was still the world’s top recipient of remittances. The diaspora sent $82 billion; nearly half came from migrant workers in West Asia.

But the Covid-19 pandemic has hit the Indian workers in West Asian countries hard. Many have lost their jobs due to suspension of projects and are stuck.

Given that the states did not have the capacity to accommodate the large number of workers, Prime Minister Narendra Modi and Foreign Minister S Jaishankar had worked the phones to reach out to the Gulf countries to ask them to take care of the Indians.

Also Read: 70% of Indian citizens abroad are in 6 W Asian nations, shows data

Indian workers in six Gulf countries account for 70 percent of 12.6 million Indians abroad. The United Arab Emirates is home to 3.4 million Indians. Another 2.6 million are in Saudi Arabia. Kuwait, Oman, Qatar and Bahrain are home to another 2.9 million NRIs.

Apart from workers in the Gulf countries, officials said, Indian missions had received requests from thousands of students who were stuck in countries across the world, ranging from the United Kingdom, Canada and the United States of America to Russia, Singapore and Philippines. In Russia alone, an official said, the total strength of Indian students is about 15,000.

“It will be a complicated exercise. Indian missions abroad will compile a list of people who want to return to India, prioritise them and then coordinate with the states concerned. When they eventually land in India, everyone would have to be screened to figure if the person should be sent to a quarantine centre or straight to the hospital,” a government official said.

The foreign ministry will have to set up a dedicated control room for this mammoth exercise, he said.

The Centre hasn’t yet decided when to start the evacuation flights but the timing, and the pace of the evacuation would be heavily dependent on governments in the home state of the workers.

If the home state of a worker is not ready to take the responsibility to house them in quarantine facilities, it may not be possible to evacuate them. It is for this reason that Cabinet Secretary Rajiv Gauba had told chief secretaries at his last virtual meeting to quickly set up quarantine facilities and hospital beds.

Kerala has been first off the block, announcing that they were prepared to accommodate at least two lakh expatriates, mainly blue-collar workers, at its special quarantine centres.","In PM Modi’s plan to evacuate Indians, blue-collar workers have the first right",https://www.hindustantimes.com/india-news/in-pm-modi-plan-to-evacuate-indians-blue-collar-workers-have-the-first-right/story-PpAIqYhtwX8m9JTEH2oKaO.html
"['tablighi', 'remark', 'bjp', 'spreading', 'mla', 'jamaatis', 'coronavirus', 'tiwari', 'sellers', 'vegetables', 'muslim', 'defends', 'deoria', 'stop', 'vendors', 'buying', 'suggested']","“On April 18, I was distributing masks among people in Deoria when I came across general complaints from people who expressed fear that Tablighi Jamaatis are spreading the infection in Deoria.
As a responsible MLA, I asked them not to take law in their hand, but simply stop buying vegetables from them.
UP Congress president Ajay Kumar Lallu blamed the legislator’s party for spreading hatred even at the time of a pandemic .
The Tablighi Jamaatis who were under attack and blamed for spreading the coronavirus have set an example by donating their plasma to cure patients.
I am confident that the countrymen will put up a united fight against Covid-19 by neglecting such comments,” said the Congress leader.","india

Updated: Apr 28, 2020 15:38 IST

A Bharatiya Janata Party MLA from Uttar Pradesh’s Deoria district kicked off a political row when he suggested to people of his constituency not to buy vegetables from Muslim vendors to avoid contracting the coronavirus infection.

In a video, now gone viral, Suresh Tiwari is seen appealing to people: “You all should keep one thing in mind, I am telling you openly: do not buy vegetables from Mia ( Muslims).”

When contacted, Tiwari confirmed to have made the remark and clarified that he suggested it as a precautionary measure to check the spread of infection after people complained to him about the role of Tablighi Jamaatis in spreading the deadly virus.

There have been several instances of the people from the minority community complaining of discrimination and harassment after a global religious congregation in New Delhi in mid-March, held by Tablighi Jamaat, an Islamic movement of preachers, turned into a hotspot of Covid-19 cases.

“On April 18, I was distributing masks among people in Deoria when I came across general complaints from people who expressed fear that Tablighi Jamaatis are spreading the infection in Deoria. Many of them were worried that Muslim vendors are infecting vegetable with saliva. As a responsible MLA, I asked them not to take law in their hand, but simply stop buying vegetables from them. Tell me, what wrong have I done by saying such things,” said the Barhaj MLA.

Tiwari’s remark drew sharp reaction from the opposition parties.

UP Congress president Ajay Kumar Lallu blamed the legislator’s party for spreading hatred even at the time of a pandemic .

“At a time when the country and state are facing the coronavirus crisis, BJP leaders are busy fanning hatred .It’s a shameful act which has exposed the real face of the BJP. The Tablighi Jamaatis who were under attack and blamed for spreading the coronavirus have set an example by donating their plasma to cure patients. I am confident that the countrymen will put up a united fight against Covid-19 by neglecting such comments,” said the Congress leader.","BJP MLA says stop buying vegetables from Muslim sellers, defends remark",https://www.hindustantimes.com/india-news/bjp-mla-says-stop-buying-vegetables-from-muslim-sellers-defends-remark/story-X0SQ9kLEmmk4LCpbyUTYGM.html
"['govt', 'evacuation', 'taken', 'international', 'seafarers', 'ports', 'shipping', 'union', 'indian', 'video', 'unions', 'waters', 'planning', 'sign', 'minister', 'stranded']","indiaUpdated: Apr 28, 2020 14:50 ISTUnion Minister of State for Shipping Mansukh Mandaviya on Monday held discussions with seafarers unions and Shipping Line Co via video conferencing and asked ship liners to provide the details of stranded Indian seafarers in international waters and abroad.
Speaking to ANI, Mandaviya said, “I discussed with seafarers unions and Shipping Lines Co via video conferencing and clearly told ship liners to provide the details of stranded Indian seafarers in international waters and abroad.”“The Ministry of Shipping is charting out the plan for the evacuation of Indian seafarers and drawing the SOP for the easing out of sign on or sign off process at Indian ports,” he added.
During COVID-19 lockdown, several decisions have been taken by the shipping ministry for the smooth functioning of ports.
At all small and majors ports, all precautionary measures have been taken to fight COVID-19.","india

Updated: Apr 28, 2020 14:50 IST

Union Minister of State for Shipping Mansukh Mandaviya on Monday held discussions with seafarers unions and Shipping Line Co via video conferencing and asked ship liners to provide the details of stranded Indian seafarers in international waters and abroad.

Speaking to ANI, Mandaviya said, “I discussed with seafarers unions and Shipping Lines Co via video conferencing and clearly told ship liners to provide the details of stranded Indian seafarers in international waters and abroad.”

“The Ministry of Shipping is charting out the plan for the evacuation of Indian seafarers and drawing the SOP for the easing out of sign on or sign off process at Indian ports,” he added.

During COVID-19 lockdown, several decisions have been taken by the shipping ministry for the smooth functioning of ports. At all small and majors ports, all precautionary measures have been taken to fight COVID-19.","Govt planning for evacuation of stranded Indian seafarers in international waters, abroad: Union minister",https://www.hindustantimes.com/india-news/govt-planning-for-evacuation-of-stranded-indian-seafarers-in-international-waters-abroad-union-minister/story-vMMOxDavoLXPTZmM16OqKL.html
"['samples', 'river', 'reduction', 'covid19', 'shut', 'quality', 'uttarakhand', 'total', 'declines', 'factories', 'ghat', 'ganga', 'water', 'lockdown', 'pollution', 'remain', 'coliform']","Composite samples of the river water were collected from five locations – Shooltankeshwar Ghat, Samne Ghat, Asi Ghat, Dashashwamedh Ghat and Raj Ghat – on the two dates, he said.
At the barrage in Rishikesh, there was a 46% reduction in fecal coliform and 25% reduction in total coliform.
Similarly, at Bindughat Dudhiavan, there was a 25% and 11% reduction in fecal coliform and total coliform, respectively.
UEPPCB officials said there was a significant improvement in water quality at Har ki Pauri during the lockdown.
“We studied data from March and April and saw significant changes in water quality after the lockdown.","india

Updated: Apr 28, 2020 15:50 IST

Authorities in Uttar Pradesh and Uttarakhand have said the quality of water in the Ganga has improved during the nationwide Covid-19 lockdown, with samples collected by a research facility in Varanasi recording a nearly 30% decrease in pollution levels.

A study of Ganga water samples collected on March 24, before the lockdown was imposed, and those collected on April 20 showed pollution had decreased by 25% to 30%, said BD Tripathi, chairman of the Mahamana Malviya Research Centre for Ganga, River Development and Water Resource Management at Banaras Hindu University (BHU).

Composite samples of the river water were collected from five locations – Shooltankeshwar Ghat, Samne Ghat, Asi Ghat, Dashashwamedh Ghat and Raj Ghat – on the two dates, he said. He explained that the term composite samples means an average of five samples were collected from different spots of every site to ensure accurate results.

“We tested biochemical oxygen demand (BOD) and the dissolved oxygen (DO) level in the samples. We found the concentration of DO increased by 20% to 30% and the concentration of BOD decreased by 35% to 40%. In total, the Ganga pollution load has decreased by 25% to 30%,” Tripathi said.

“There has been a very positive effect on the Ganga and the river shows it can rejuvenate itself,” he added.

Tripathi attributed the decrease in pollution to many reasons, including a decrease of around 40% in the number of bodies cremated at Manikarnika Ghat and Harishchandra Ghat, and a check on immersion of remains of cremated bodies in the river.

The discharge of toxic effluents from more than 1,000 small-scale and cottage industries and motor workshops too has completely stopped at Varanasi, he said.

The “highest transparency” was observed during the sampling of water because fish were seen swimming up to a depth of one metre from the surface of the Ganga, Tripathi said.

In Uttarakhand’s capital Dehradun, authorities said a comparison of water quality of the Ganga at different locations from Devaprayag, done between March and April, showed the quality had improved significantly. The water at Har Ki Pauri was found fit for drinking in April, and the state government now plans to work on measures to keep the quality consistent and pollution-free.

State forest and environment minister Harak Singh Rawat said: “With the latest data on improved water quality of the Ganga, we are going to study it with experts and decide on short-term measures which will help us maintain this quality even after the lockdown.

“Clearly, nature has cleaned the river on its own due to fewer anthropological activities.”

Tripathi too said authorities need to take a cue from the lockdown to improve the water quality in future.

Data released amid the lockdown by the Uttarakhand Environment Protection and Pollution Control Board (UEPPCB) showed there was a 47% reduction in fecal coliform at Lakshmanjhula.

At the barrage in Rishikesh, there was a 46% reduction in fecal coliform and 25% reduction in total coliform. Similarly, at Bindughat Dudhiavan, there was a 25% and 11% reduction in fecal coliform and total coliform, respectively.

At Har Ki Pauri, there was a 20% reduction in BOD, 34% reduction in fecal coliform and 17% reduction in total coliform, whereas at Jagjeetpur in Haridwar, officials observed a 17% reduction in BOD and fecal coliform and a 27% reduction in total coliform.

UEPPCB officials said there was a significant improvement in water quality at Har ki Pauri during the lockdown. UEPPCB member secretary SP Subudhi said fewer pollutants are entering the river as factories are closed.

“We studied data from March and April and saw significant changes in water quality after the lockdown. This is mostly due to factories being shut, hotels being closed, and less mobile population in and around Haridwar,” said Subudhi.

“We will be taking samples from the same spots again to reconfirm the findings, based on which suggestion can be made to the state and Central government on how to keep the water quality of the Ganga consistent.”

Sewage treatment plants in the state are working according to norms and without extra load because of the lockdown, reducing pollutants in rivers.

BD Joshi, an environmental scientist and founder of the Indian Academy of Environmental Sciences, said the water quality has improved due to reduced anthropological pressures on the Ganga but this will be very difficult to maintain once the lockdown ends.

“In the past five to six weeks, the Ganga has cleansed itself but it is very difficult to say how much of this will continue after the lockdown. There is definitely a psychological impact on people due to the pandemic, on how people should respect nature and the environment, which can help us keep the river clean. The government and law enforcement agencies can use this to spread awareness among more people, which gives us hope the water quality might be maintained,” said Joshi.","Covid-19 lockdown: Pollution in Ganga declines as factories in UP, Uttarakhand remain shut",https://www.hindustantimes.com/india-news/covid-19-lockdown-pollution-in-ganga-declines-as-factories-in-up-uttarakhand-remain-shut/story-ZKGahS4TVfIQqLAOQyHSxM.html
"['states', 'quarantine', 'countries', 'abroad', 'india', 'modi', 'plan', 'right', 'evacuate', 'indian', 'modis', 'united', 'indians', 'workers', 'bluecollar']","In PM Modi’s plan to evacuate Indians, blue-collar workers have the first rightindiaUpdated: Apr 28, 2020 17:31 ISTAs the foreign and civil aviation ministries start work on a plan to fly back tens of thousands of Indians stuck abroad, Prime Minister Narendra Modi has spelt out the ground rule for the evacuation plan.
India’s blue collar workers stranded abroad will get the first seats in the special flights that will be run by the government to get them home.
But the Covid-19 pandemic has hit the Indian workers in West Asian countries hard.
Also Read: 70% of Indian citizens abroad are in 6 W Asian nations, shows dataIndian workers in six Gulf countries account for 70 percent of 12.6 million Indians abroad.
Kerala has been first off the block, announcing that they were prepared to accommodate at least two lakh expatriates, mainly blue-collar workers, at its special quarantine centres.","In PM Modi’s plan to evacuate Indians, blue-collar workers have the first right

india

Updated: Apr 28, 2020 17:31 IST

As the foreign and civil aviation ministries start work on a plan to fly back tens of thousands of Indians stuck abroad, Prime Minister Narendra Modi has spelt out the ground rule for the evacuation plan. India’s blue collar workers stranded abroad will get the first seats in the special flights that will be run by the government to get them home.

Students stranded in different countries will be next. Then, everyone else including Indians who were travelling for work, or pleasure.

“The prime minister was very clear… That the Indian expatriate workforce should get the first choice to return,” a top government official told Hindustan Times.

At one meeting, PM Modi pointed out how the poorest of Indian immigrant workers - mostly in the Gulf countries - had helped India tide over the economic crisis. Like in 1998, PM Modi told them, when the United States and other western countries imposed economic sanctions on India after the then PM Atal Bihari Vajpayee detonated five underground nuclear bombs in Pokhran in May 1998.

Also Watch | ‘Surviving on cold food’: Stranded Indian students in US seek govt’s help for evacuation

The Resurgent India Bond floated by the State Bank of India was targeted to raise $2 billion; it netted more than $4 billion.

Two decades later, India’s massive diaspora is still sending money home. In 2019, according to the World Bank, India was still the world’s top recipient of remittances. The diaspora sent $82 billion; nearly half came from migrant workers in West Asia.

But the Covid-19 pandemic has hit the Indian workers in West Asian countries hard. Many have lost their jobs due to suspension of projects and are stuck.

Given that the states did not have the capacity to accommodate the large number of workers, Prime Minister Narendra Modi and Foreign Minister S Jaishankar had worked the phones to reach out to the Gulf countries to ask them to take care of the Indians.

Also Read: 70% of Indian citizens abroad are in 6 W Asian nations, shows data

Indian workers in six Gulf countries account for 70 percent of 12.6 million Indians abroad. The United Arab Emirates is home to 3.4 million Indians. Another 2.6 million are in Saudi Arabia. Kuwait, Oman, Qatar and Bahrain are home to another 2.9 million NRIs.

Apart from workers in the Gulf countries, officials said, Indian missions had received requests from thousands of students who were stuck in countries across the world, ranging from the United Kingdom, Canada and the United States of America to Russia, Singapore and Philippines. In Russia alone, an official said, the total strength of Indian students is about 15,000.

“It will be a complicated exercise. Indian missions abroad will compile a list of people who want to return to India, prioritise them and then coordinate with the states concerned. When they eventually land in India, everyone would have to be screened to figure if the person should be sent to a quarantine centre or straight to the hospital,” a government official said.

The foreign ministry will have to set up a dedicated control room for this mammoth exercise, he said.

The Centre hasn’t yet decided when to start the evacuation flights but the timing, and the pace of the evacuation would be heavily dependent on governments in the home state of the workers.

If the home state of a worker is not ready to take the responsibility to house them in quarantine facilities, it may not be possible to evacuate them. It is for this reason that Cabinet Secretary Rajiv Gauba had told chief secretaries at his last virtual meeting to quickly set up quarantine facilities and hospital beds.

Kerala has been first off the block, announcing that they were prepared to accommodate at least two lakh expatriates, mainly blue-collar workers, at its special quarantine centres.","In PM Modi’s plan to evacuate Indians, blue-collar workers have the first right",https://www.hindustantimes.com/india-news/in-pm-modi-plan-to-evacuate-indians-blue-collar-workers-have-the-first-right/story-PpAIqYhtwX8m9JTEH2oKaO.html
